{
  "schemaVersion": "1.0.0",
  "testPlanId": "TP-EC-12000-001",
  "artifactVersion": 3,
  "release": "26.3",
  "capability": "paper-out-export",
  "jiraStoryIds": [
    "EC-12000"
  ],
  "requirementIds": [
    "REQ-EC-12000-001",
    "REQ-EC-12000-002",
    "REQ-EC-12000-003",
    "REQ-EC-12000-004",
    "REQ-EC-12000-005",
    "REQ-EC-12000-006",
    "REQ-EC-12000-007"
  ],
  "acIds": [
    "AC-EC-12000-001",
    "AC-EC-12000-002",
    "AC-EC-12000-003",
    "AC-EC-12000-004",
    "AC-EC-12000-005",
    "AC-EC-12000-006",
    "AC-EC-12000-007",
    "AC-EC-12000-008",
    "AC-EC-12000-009",
    "AC-EC-12000-010",
    "AC-EC-12000-011",
    "AC-EC-12000-012",
    "AC-EC-12000-013",
    "AC-EC-12000-014",
    "AC-EC-12000-015",
    "AC-EC-12000-016",
    "AC-EC-12000-017",
    "AC-EC-12000-018",
    "AC-EC-12000-019"
  ],
  "openSpecRefs": [
    "openspec/changes/track-paper-out-media-type/specs/paper-out-export/spec.md",
    "openspec/changes/track-paper-out-media-type/proposal.md",
    "openspec/changes/track-paper-out-media-type/design.md"
  ],
  "objective": "Verify that a Paper Out/Export package's Media Type is derived from what the requester (UI user or API integrator) actually declares - not from the submission channel alone - that the acknowledgement flow for Save as Electronic File behaves as specified, that the mediaType element is correctly optional on eoRequestExport, that Media Type is logged on the Submitted Paper Out event and never backfilled retroactively, and that the two small UI text/layout fixes ship. Each scenario asserts only what its approved acceptance criterion asserts.",
  "scope": {
    "inScope": [
      "Media Type for Paper Out Package section on the Paper Out Request modal (AC-EC-12000-001).",
      "Acknowledgement modal behavior for Save as Electronic File: gated OK, always-enabled Cancel, Work Queue item creation on confirm, no side effect on cancel (AC-EC-12000-002 through -004).",
      "eoRequestExport / export.xsd optional mediaType element and backward compatibility (AC-EC-12000-005, -006).",
      "Media Type determination logic for UI and API paths, at transaction and document level (AC-EC-12000-007 through -015).",
      "Media Type Additional Information logged on Submitted Paper Out, visible on cover page/audit trail/activity history reports, and never backfilled (AC-EC-12000-016, -017).",
      "Verify Paper Out modal checkbox verbiage update (AC-EC-12000-018).",
      "Paper Out Request modal right-side border alignment (AC-EC-12000-019).",
      "Collections-initiated Paper Out reusing the same modal and logic, per AMB-EC-12000-001's resolution (Collections accordion > Batch > Paper Out Request)."
    ],
    "outOfScope": [
      "Any part of the eoRequestExport / export.xsd contract beyond the new mediaType element - not defined by this story and not authored here.",
      "Retroactive Media Type backfill on historical transactions/documents - explicitly excluded by the story (AC-EC-12000-017 asserts the exclusion itself).",
      "The full authoritative eoRequestExport request/response contract - unresolved as AMB-EC-12000-002 until captured via Playwright MCP at PLAYWRIGHT_VALIDATION and promoted to HUMAN_APPROVED by a human reviewer."
    ]
  },
  "assumptions": [
    "The eCore Command Center application under test is reachable at the configured base URL from the executing network.",
    "A user account with permission to initiate a Paper Out Request (transaction and document level, including via Collections) exists and is supplied through environment configuration, never through this artifact.",
    "The approved acceptance criteria are the only source of expected behavior; where a criterion is deliberately abstract, the corresponding scenario stays abstract.",
    "Approver = the currently logged-in user, and Name of Request (requester name) = \"Anil Kumar\", per AMB-EC-12000-003's resolution, are used as the fabricated test data values for the required Paper Out Request modal fields."
  ],
  "dependencies": [
    "requirements/approved/EC-12000.json at artifactVersion 1.",
    "requirements/approved/EC-12000-ac-approval.json - Gate 1 decision APPROVE for all 19 criteria.",
    "openspec/changes/track-paper-out-media-type/specs/paper-out-export/spec.md.",
    "reports/validation/ecore-api-discovery.json - confirms eoRequestExport does not appear in observedEndpoints or declaredButNotObserved, i.e. it is genuinely unverified rather than merely unobserved.",
    "Application observation at the PLAYWRIGHT_VALIDATION stage to capture the real eoRequestExport request/response and to confirm the Collections navigation path resolved in AMB-EC-12000-001.",
    "test-data/paper-out-export.sample.json (to be created at IMPLEMENTATION) for the fabricated requester/approver values.",
    "reports/validation/TP-EC-12000-001-api-validation.json - records the AGENT_DRAFTED, human-dictated eoRequestExport endpoint description (contractSource UNVERIFIED); see CLR-TP-EC-12000-004 for the open reviewer decision this depends on.",
    "reports/jira/attachments/eoRequestExport.xml and Paper-Out.xml - added 2026-09-15; SoapUI operation metadata and a fourth SOAP-enveloped request sample respectively. Neither is a response sample."
  ],
  "risks": [
    {
      "riskId": "RISK-TP-EC-12000-001",
      "description": "eoRequestExport has no authoritative contract and does not even appear in reports/validation/ecore-api-discovery.json's declaredButNotObserved list, so its request/response shape is completely unverified, not merely unconfirmed.",
      "level": "HIGH",
      "mitigation": "AC-EC-12000-005, -006 and -011 through -015 are declared interfaceType API with apiContract.contractSource UNVERIFIED. They cannot back an assertion until Playwright MCP observation at PLAYWRIGHT_VALIDATION produces a contract that a human promotes to HUMAN_APPROVED with a recorded responseShapeHash. No endpoint path or status code is guessed."
    },
    {
      "riskId": "RISK-TP-EC-12000-002",
      "description": "Confirming the acknowledgement modal creates a real Work Queue approval item against shared QA data, which is a write with a downstream effect (an approval workflow item).",
      "level": "MEDIUM",
      "mitigation": "Only fabricated requester/approver test data is used (never a real business identity); the created Work Queue item is a normal, reversible approval-queue entry rather than a destructive call, and its creation is itself the behavior AC-EC-12000-003 requires being verified."
    },
    {
      "riskId": "RISK-TP-EC-12000-003",
      "description": "Moving Media Type Additional Information from the Authorized Paper Out event to the Submitted Paper Out event could break any pre-existing automation or report that reads the old event location.",
      "level": "MEDIUM",
      "mitigation": "AC-EC-12000-016 and -017 assert the new location and the no-retroactive-update rule explicitly, so this is treated as a deliberate, visible behavior change. Any pre-existing automation asserting the old event must be reviewed at IMPLEMENTATION time rather than left silently broken."
    },
    {
      "riskId": "RISK-TP-EC-12000-004",
      "description": "The Collections entry point's reuse of the same modal (AMB-EC-12000-001) is a human-supplied answer, not yet confirmed against the running application.",
      "level": "LOW",
      "mitigation": "The Collections navigation path is validated against the real application via Playwright MCP at PLAYWRIGHT_VALIDATION before automation asserts it as fact."
    },
    {
      "riskId": "RISK-TP-EC-12000-005",
      "description": "The eoRequestExport endpoint (method, path, content-type and form-part names) was supplied by a human reviewer in chat rather than an independently observed or documented source -- no WSDL, integration guide, or captured network trace corroborates it. Per AGENTS.md rule 4's drafting exception it is recorded as AGENT_DRAFTED with contractSource UNVERIFIED. If the dictated endpoint is wrong, the call may fail safely, or may reach an unintended host/operation with a real side effect, because the request is genuinely issued rather than merely observed.",
      "level": "HIGH",
      "mitigation": "TS-EC-12000-011 through -015 remain scaffoldingOnly: true; Media Type continues to be asserted exclusively via the UI audit trail (CLR-TP-EC-12000-001), never via the API response, so a wrong or malformed response cannot produce a false pass. expectedStatusCodes=[200] is PROPOSED only and does not gate the acceptance criterion."
    },
    {
      "riskId": "RISK-TP-EC-12000-006",
      "description": "eoRequestExport is destructive-by-name (its own request schema carries deleteIfEmpty and irreversible retentionPolicy attributes) and would now be called for real, against the shared qa5 fixture, by TS-EC-12000-011 through -015 -- in addition to the eight UI-driven Submit+Cancel scenarios (TS-EC-12000-003, -007 through -010, -016) already approved in v1/v2 against the same single qualifying fixture collection.",
      "level": "HIGH",
      "mitigation": "CLEANUP mechanism confirmed at Gate 2 (reviewer Anil, 2026-09-15) and observed live against qa5: Print the Work Queue item, select all in the Verify Paper Out modal, click Verify, confirm the alert -- this clears the item from the Work Queue (mirrors the existing MANUAL_ONLY flow documented in TS-EC-12000-020). Fixtures must be selected dynamically from the currently available Collections list at run time (never a hard-coded id), reducing contention with the eight already-approved UI scenarios sharing the same pool."
    }
  ],
  "scenarios": [
    {
      "testScenarioId": "TS-EC-12000-001",
      "title": "The Paper Out Request modal shows the Media Type section with Print to Paper selected by default",
      "type": "POSITIVE",
      "acIds": [
        "AC-EC-12000-001"
      ],
      "preconditions": [